budget,genres,homepage,id,keywords,original_language,original_title,overview,popularity,production_companies,production_countries,release_date,revenue,runtime,spoken_languages,status,tagline,title,vote_average,vote_count
6000000,"Crime, Drama, Music",Released,The screen achieves one of the great entertainments in the history of motion pictures,West Side Story,7.0,389
6000000,"Comedy",Released,The snobs against the slobs!,Caddyshack,6.6,365
0,"Comedy, Drama, Romance",Released,null,The Brothers,6.5,10
6000000,"Comedy, Drama, Romance",Released,From best friends to best men.,The Wood,7.1,34
6000000,"Drama, Crime, Thriller",Released,Five Criminals. One Line Up. No Coincidence.,The Usual Suspects,8.1,3254
8000000,"Horror, Thriller",Released,"Now Freddy’s a daddy, he’s killing for two.",A Nightmare on Elm Street 5: The Dream Child,5.5,245
5000000,"Comedy, Romance",Released,Don't Graduate. Celebrate.,National Lampoon’s Van Wilder,5.9,858
6000000,"Drama, Romance",Released,Love. Pain. Glory.,The Wrestler,7.3,1000
6000000,"Western",Released,Emotions . . . As Violent As The Wind-Swept Prairie !,Duel in the Sun,6.2,37
0,"Comedy",Released,Some pets deserve a little more respect than others.,Best in Show,6.7,166
6000000,"Science Fiction, Action",Released,1997. New York City is now a maximum security prison. Breaking out is impossible. Breaking in is insane.,Escape from New York,6.9,703
0,"Comedy, Drama",Released,null,School Daze,6.2,26
6000000,"Comedy, Family",Released,The summer is going to be in tents.,Daddy Day Camp,4.4,91
12716953,"Crime, Action, Comedy",Released,Fight first. Apologize later.,Mr. Nice Guy,6.3,128
6000000,"Comedy, Music",Released,"Back together for the first time, again.",A Mighty Wind,6.6,74
0,"Comedy, Drama, Romance",Released,A Romantic Comedy With The Works,Mystic Pizza,5.9,123
6000000,"Comedy, Drama, Fantasy, Romance",Released,What if one split second sent your life in two completely different directions?.,Sliding Doors,6.5,354
6000000,"Crime, Horror, Thriller",Released,Chill or be Chilled,Tales from the Hood,5.4,32
6000000,"Drama",Released,Charming. Magnetic. Murderous.,The Last King of Scotland,7.4,558
5000000,"Horror, Thriller",Released,"Michael Lives, And This Time They're Ready!",Halloween 5: The Revenge of Michael Myers,5.2,183
5000000,"Comedy, Crime, Drama",Released,A story so unbelievable it must be true.,Bernie,6.5,320
6000000,"Documentary",Released,null,Dolphins and Whales: Tribes of the Ocean,8.0,3
0,"Drama, Romance",Released,A true portrait of life and art.,Pollock,6.6,91
6000000,"Comedy, Drama, Romance",Released,It's 11:59 on New Years Eve... do you know where your date is?,200 Cigarettes,6.1,44
6000000,"Drama, Thriller",Released,There's more than one way to take a life.,The Words,6.4,379
0,"Comedy, Western",Released,Funniest movie you'll ever read.,Casa De Mi Padre,5.5,103
6000000,"Drama, Comedy",Released,Truth is stranger than family,City Island,6.9,113
6000000,"Action, Comedy, Thriller, Crime",Released,The FBI are about to discover that things work a little differently around here.,The Guard,6.8,372
7000000,"Comedy",Released,null,College,4.8,48
6000000,"Drama, Romance",Released,"Beautiful, mysterious, haunting, invariably fatal. Just like life.",The Virgin Suicides,7.1,817
0,"Comedy, Drama",Released,Finding your own voice can be magic.,Little Voice,6.6,61
0,"Comedy, Romance",Released,"After four years in a coma, Eugene Pratt is going to be reunited with his high school sweetheart... on pages 95-97.",Miss March,5.4,77
5500000,"Drama, Comedy",Released,Life is an occasion. Rise to it.,Wish I Was Here,6.4,300
6000000,"Comedy",Released,Magic opened up their hearts... Love did the rest.,Simply Irresistible,5.5,52
0,"Comedy, Music",Released,An anatomically incorrect rock odyssey,Hedwig and the Angry Inch,7.4,80
6000000,"Action",Released,The ultimate martial art.,Only the Strong,6.9,29
0,"Mystery, Drama, Thriller, Horror",Released,Be Careful Who You Get Close To,Goddess of Love,6.2,9
6000000,"Drama, History",Released,null,Shattered Glass,6.6,111
6000000,"Comedy, Crime, Thriller",Released,null,Novocaine,6.0,44
0,"Drama, Thriller",Released,null,The Business of Strangers,5.7,19
6244087,"Adventure, Western",Released,"If you only want to spend two hours in a movie theatre and go home and forget it, stay away from THE WILD BUNCH.",The Wild Bunch,7.6,259
6000000,"Drama",Released,null,The Wackness,6.2,94
6000000,"Thriller, Adventure, Drama, Crime",Released,Never have so few taken so much from so many.,The First Great Train Robbery,6.6,74
0,"Drama",Released,null,Morvern Callar,7.2,34
6000000,"Action, Adventure, Fantasy, Science Fiction",Released,null,Beastmaster 2: Through the Portal of Time,4.6,17
6000000,"Drama",Released,Rising from tragedy to triumph,The 5th Quarter,4.7,12
0,"Drama",Released,null,The Flower of Evil,5.7,10
6000000,"Drama",Released,null,The Greatest,6.2,34
134005,"Drama, History",Released,null,Snow Flower and the Secret Fan,5.3,22
6000000,"Drama, Romance",Released,"Before you fall in love, you need to love yourself.",Come Early Morning,5.9,10
0,"Action, Comedy",Released,null,Lucky Break,6.5,11
0,"Drama",Released,The story of two women whose friendship suddenly became a matter of life and death.,Julia,6.3,30
6000000,"Comedy",Released,null,"Surfer, Dude",4.7,25
0,"Documentary",Released,Exploring the Issue that Divides the World,Lake of Fire,8.0,10
6000000,"Crime, Drama, Thriller",Released,Fate can change in seconds.,11:14,6.8,206
0,"Action, Thriller",Released,"Killers for hire are paid for what they can do, not for what they believe... until today.",Men of War,5.4,29
0,"Crime, Mystery, Thriller",Released,Some secrets are better left buried.,Don McKay,5.4,21
12000000,"Crime, Drama, Thriller",Released,Twisty thriller... a wild ride.,Deadfall,5.6,224
6000000,"Drama, Family",Released,An abandoned child brings the colors of love into their lives.,A Shine of Rainbows,6.3,14
6000000,"Action, Thriller",Released,Who's on your list?,The Hit List,5.2,73
0,"Romance, Comedy, Drama",Released,null,Emma,7.6,38
5952000,"Horror, Mystery, Science Fiction",Released,First it controls your mind. Then it destroys your body.,Videodrome,7.1,454
5300000,"Drama, Comedy, Romance",Released,"They came from Paris, Rome, London and Berlin to... the Spanish Apartment... where a year can change a lifetime.",The Spanish Apartment,7.0,266
6000000,"Drama",Released,A moment can change everything.,Song One,5.5,87
4000000,"Drama, History, War",Released,"In 1945 Holland, a boy must choose between good and evil.",Winter in Wartime,6.8,66
0,"Comedy",Released,Crime is such a trippy thing,Freaky Deaky,4.9,18
5800000,"Action, Drama, Thriller, War",Released,"It carried their hopes, their nation's honour!",The Train,7.2,72
0,"Drama, Thriller",Released,Justice needs a hero,Trade Of Innocents,5.5,12
6000000,"Action, Crime, Drama, Thriller",Released,Vengeance Knows No Mercy,The Protector,6.8,167
0,"Comedy",Released,null,Stiff Upper Lips,10.0,1
3500159,"Comedy, Drama, Romance",Released,"Sometimes, to follow your dreams... you've got to bend the rules!",Bend It Like Beckham,6.2,578
0,"Drama",Released,Greetings from ...,Sunshine State,6.0,10
5800000,"Action, Adventure, Drama",Released,null,Crossover,4.2,10
0,"Action, Comedy",Released,null,Khiladi 786,4.7,11
5600000,"Thriller, Horror]"²,6.4,489
0,"Comedy, Music, Family",Released,Dance - Sing - Dream,Standing Ovation,3.9,6
5500000,"Comedy, Crime, Drama",Released,...all it takes is a little confidence.,The Sting,7.9,622
5500000,"Drama, History",Released,"This is the story of two men who run, not to run, but to prove something to the world. They will sacrifice anything to achieve their goals... except their honor.",Chariots of Fire,6.8,207
0,"Comedy, Drama, Romance",Released,Time heals the heart. Faith heals the rest.,Diary of a Mad Black Woman,6.4,71
0,"Drama",Released,A true story of the mystery of music and the miracle of love,Shine,7.3,131
6000000,"Romance, Comedy, Drama",Released,Everyone loves a happy ending.,Don Jon,5.9,1671
5500000,"Western",Released,Welcome to Hell,High Plains Drifter,7.4,278
7000000,"Comedy, Drama",Released,Accentuate the negative.,Ghost World,7.1,426
0,"Drama, Romance",Released,null,Iris,6.2,47
5500000,"Comedy, Science Fiction",Released,She's too good to be true...and too real to be otherwise.,Galaxina,3.3,16
0,"Drama",Released,null,The Chorus,7.5,526
4361898,"Comedy, Romance",Released,Things change. Family doesn't.,Mambo Italiano,5.6,28
5000000,"Crime, Drama, Mystery, Thriller",Released,"Sex, drugs, murder. Welcome to L.A.",Wonderland,6.2,73
6500000,"Drama",Released,"It's the hottest day of the summer. You can do nothing, you can do something, or you can...",Do the Right Thing,7.6,292
0,"Drama",Released,"Passion, Seduction, Deception.",Harvard Man,4.8,15
3850000,"Drama, Comedy",Released,null,Le Havre,6.8,97
0,"Drama, Thriller, Crime, Mystery",Released,Time destroys everything.,Irreversible,7.1,538
5500000,"Comedy, Drama",Released,M For Father,R100,5.4,31
2200000,"Drama",Released,A Generation Awakens,Rang De Basanti,7.2,97
0,"Drama",Released,null,Animals,6.2,9
8000000,"Comedy, Thriller, Action, Drama",Released,Faith alone doesn’t cut it anymore,Salvation Boulevard,5.6,28
0,"Comedy",Released,"If He'd meant the commandments literally, He'd have written them in stone.",The Ten,4.9,57
0,"Drama, Comedy, Foreign",Released,null,A Room for Romeo Brass,7.3,18
0,"Thriller, Crime",Released,The hunt is on.,Headhunters,7.1,399
0,"Science Fiction, Comedy, Thriller, Horror",Released,"For the locals on Erin Island, it's last orders.",Grabbers,6.0,140
0,"Comedy, Drama",Released,He's hoping for a miracle. He doesn't have a prayer.,Saint Ralph,7.3,24
5500000,"Drama",Released,Love is a foolish game,Miss Julie,5.9,45
5100000,"Science Fiction, Drama, Fantasy, Romance",Released,Beyond fantasy. Beyond obsession. Beyond time itself... he will find her.,Somewhere in Time,7.2,102
0,"Drama, Action, Crime, Foreign",Released,Goa. Paradise on Earth. But every Paradise has a few snakes.,Dum Maaro Dum,5.4,7
5000000,"Horror, Thriller",Released,It will take what you love most.,Insidious: Chapter 2,6.5,1211
4000000,"Horror",Released,Oh Yes... There Will Be Blood.,Saw II,6.3,1251
15000000,"Thriller, Science Fiction, Drama",Released,Monsters come in many forms.,10 Cloverfield Lane,6.8,2468
5000000,"Documentary, Comedy",Released,Do not attempt this at home.,Jackass: The Movie,6.1,345
4900000,"Horror, Thriller",Released,null,Lights Out,6.3,1129
5000000,"Horror",Released,It Runs In The Family,Paranormal Activity 3,5.9,669
5000000,"Horror",Released,Keep telling yourself it's just a game,Ouija,4.9,983
5000000,"Horror, Thriller",Released,"If you think you're ready for Freddy, think again!",A Nightmare on Elm Street 3: Dream Warriors,6.5,354
5500000,"Comedy, Drama",Released,Life doesn't care if you're ready.,Instructions Not Included,7.5,205
5000000,"Horror",Released,It's closer than you think,Paranormal Activity 4,5.2,563
4100000,"Drama",Released,The first motion picture in CinemaScope--the modern miracle you see without glasses!,The Robe,6.4,42
5000000,"Comedy",Released,null,The Return of the Pink Panther,6.7,137
11000000,"Horror, Thriller, Comedy",Released,They saved the best for last.,Freddy's Dead: The Final Nightmare,5.1,272
8000000,"Crime, Drama",Released,The first female serial killer of America,Monster,7.0,485
5000000,"Adventure, Drama, Science Fiction",Released,The mightiest motion picture of them all!,"20,000 Leagues Under the Sea",6.8,157
5000000,"Horror, Thriller",Released,You're one of us now.,Paranormal Activity: The Marked Ones,5.2,449
5000000,"Drama, History",Released,I am not an animal! I am a human being! I... am... a man!,The Elephant Man,7.9,719
5000000,"Drama, History",Released,Sometimes it takes a hustler to change the world,Dallas Buyers Club,7.9,2886
3300000,"Thriller, Horror",Released,Evil will rise.,The Lazarus Effect,5.1,505
9000000,"Mystery, Thriller",Released,Some memories are best forgotten.,Memento,8.1,4028
5000000,"Horror",Released,You see what it wants you to see,Oculus,6.3,1050
5000000,"Comedy",Released,With No Power Comes No Responsibility,Clerks II,6.9,398
5000000,"Drama, Comedy, Music",Released,Inside every one of us is a special talent waiting to come out. The trick is finding it.,Billy Elliot,7.4,750
4600000,"Comedy, Drama",Released,We've all been there.,The Way Way Back,7.1,688
0,"Comedy",Released,null,House Party 2,4.7,21
3500000,"Family, Drama, Action, Western, Romance",Released,The story of a boy suddenly alone in the world. The men who challenge him. And the girl who helps him become a man.,The Man from Snowy River,6.8,37
0,"Animation, Family, Comedy",Released,You'll Dig Doug!,Doug's 1st Movie,5.4,22
5000000,"Drama",Released,The hardest soul to save was his own.,The Apostle,6.1,38
0,"Drama",Released,The meanest mother of them all,Mommie Dearest,6.5,54
10000000,"Comedy, Drama",Released,Everybody has one,Our Idiot Brother,5.9,365
5000000,"Action, Drama",Released,The incredible true story of gold medal champion Jesse Owens,Race,7.1,478
0,"Drama",Released,"Here, we get down and dirty.",The Players Club,6.4,14
5000000,"Horror, Thriller",Released,The only way out is down.,"As Above, So Below",6.1,766
0,"Drama, Thriller",Released,Every Woman Needs an Escape,Addicted,5.4,63
0,"Drama",Released,The secrets that hold us together can also tear us apart.,Eve's Bayou,6.1,27
5000000,"Drama",Released,null,Still Alice,7.5,1104
5000000,"History, Drama",Released,"To Nefer, shameless temptress of Babylon, he surrendered his parents' hope of immortality!",The Egyptian,6.0,11
5000000,"Action, Crime, Thriller",Released,A terrorist holds New York in a grip of fear - and only Stallone can take him on.,Nighthawks,6.4,86
5000000,"Horror, Thriller",Released,The Big Apple's in BIG trouble!,Friday the 13th Part VIII: Jason Takes Manhattan,4.8,191
5000000,"Comedy, Drama, Romance",Released,Love is here to stay... so is her family.,My Big Fat Greek Wedding,6.2,671
5000000,"Drama, Crime",Released,A little sun can bring out your dark side.,Spring Breakers,5.0,1551
5000000,"Horror, Thriller",Released,Haddonfield is ready to celebrate Halloween.... so is Michael Myers!,Halloween: The Curse of Michael Myers,5.0,170
5000000,"Drama, Romance",Released,Life has its ways of teaching. Life has its ways to confuse us. Life has its ways to move us. Life has its ways to amaze. Life has its ways to hurt us. Life has its ways to heal. Life has its ways to inspire.,Y Tu Mamá También,7.3,315
4000000,"Horror, Comedy",Released,A romantic comedy. With zombies.,Shaun of the Dead,7.5,2420
0,"Drama, Horror",Released,Her past is yet to come.,The Haunting of Molly Hartley,4.3,48
5000000,"Drama, Mystery, Romance",Released,John Sayles invites you to return to the scene of the crime.,Lone Star,6.9,77
5000000,"Horror, Thriller",Released,Horror has returned to Haddonfield.,Halloween 4: The Return of Michael Myers,5.9,209
5000000,"Horror, Mystery",Released,Childish pranks turn into a bloody battle for survival!,April Fool's Day,5.8,73
0,"Comedy, Drama",Released,"Suddenly, life was more than French fries, gravy, and girls.",Diner,6.9,83
5000000,"Action, Crime, Drama, Romance, Thriller, Western",Released,The 'Mad Dog' Criminal...The 'Lone Wolf' Lawman...The Ultimate Showdown.,Lone Wolf McQuade,5.5,67
5000000,"Horror, Thriller, Science Fiction",Released,There's a reason we've never gone back to the moon.,Apollo 18,5.0,356
5000000,"Comedy, Drama",Released,life's a messy business.,Sunshine Cleaning,6.5,255
5000000,"Action, Thriller",Released,No rescue. No refuge.,No Escape,6.7,777
0,"Action, Fantasy",Released,"Born with the courage of an eagle, the strength of a black tiger, and the power of a god.",The Beastmaster,6.0,97
5000000,"Drama, History, Romance, War",Released,Only once in 3000 years...anything like...,Solomon and Sheba,5.4,8
20000000,"Romance, Comedy",Released,Way shadier than gray.,Fifty Shades of Black,4.3,331
0,"Drama, Romance",Released,null,Not Easily Broken,6.3,9
4,"Drama, Romance, War",Released,Every woman who has loved will understand,A Farewell to Arms,6.2,28
0,"Comedy, Romance",Released,t's what everyone's looking for,The Perfect Match,5.2,42
5500000,"Fantasy, Animation, Science Fiction, Family",Released,null,Digimon: The Movie,6.2,72
0,"Comedy, Drama",Released,null,Saved!,6.3,147
8000000,"Comedy, Crime, Drama",Released,"A provocative new comedy about sex, friendship, and all other things that invade our lives.",The Barbarian Invasions,6.7,77
0,"Action, Adventure, Drama, Romance",Released,Love is the greatest adventure of all.,Robin and Marian,6.6,50
5000000,"Action, Adventure, Horror, Thriller",Released,The night... has an appetite.,The Forsaken,4.9,47
5000000,"Action, Adventure, War, Thriller",Released,null,Force 10 from Navarone,6.4,91
5000000,"Comedy",Released,"A lot of TV stations have forgotten what ""quality"" means, but not Channel 62. They NEVER knew what it meant.",UHF,6.7,89
0,"Comedy",Released,A movie that proves you're never too old to come of age.,Grandma's Boy,6.6,220
5000000,"Comedy, Drama",Released,Growing Up is Hard to Do,Slums of Beverly Hills,6.5,44
5000000,"Western",Released,There were three men in her life. One to take her... one to love her... and one to kill her.,Once Upon a Time in the West,8.1,1128
5000000,"Action, Comedy, Thriller",Released,Welcome to disorganized crime.,Made,6.3,55
5000000,"Science Fiction, Drama",Released,The last place you'd ever expect to find yourself.,Moon,7.6,1794
0,"Comedy",Released,A 13-year-old boy uses his upcoming bar mitzvah to reconcile the strained relationship between his father and grandfather.,Keeping Up with the Steins,5.2,18
5000000,"Documentary",Released,The T-Rex of the Seas come alive.,Sea Rex 3D: Journey to a Prehistoric World,5.9,11
5000000,"Drama",Released,There is no such thing as the simple truth.,The Sweet Hereafter,6.8,103
4000000,"Drama, History",Released,"In the face of terror, their greatest weapon was faith...",Of Gods and Men,6.5,91
5000000,"Comedy, Drama",Released,"Based on a true story of love, victory, and fermentation",Bottle Shock,6.6,60
0,"Comedy, Horror, Science Fiction",Released,The comedy that examines modern living through chemistry,Jekyll and Hyde ... Together Again,4.6,5
5000000,"Drama, Fantasy",Released,From a secret world no one could see... came a crime no one could believe.,Heavenly Creatures,7.0,294
5000000,"Drama",Released,Hope lives,90 Minutes in Heaven,5.4,40
5000000,"Comedy, Drama, Romance",Released,Lost is a good place to find yourself,Everything Must Go,6.0,208
5000000,"Comedy, Crime, Mystery, Thriller",Released,The world's most private detective.,Zero Effect,6.0,55
5000000,"Thriller, Drama",Released,A little guilt goes a long way...,The Machinist,7.3,1247
5000000,"Drama, Crime",Released,He was a good man in a deadly business. She was his only way out.,Light Sleeper,5.7,15
5000000,"Thriller, Crime, Drama, Mystery",Released,Can you keep a national secret?,Kill the Messenger,6.6,355
5000000,"Drama",Released,The only way out is through.,Rabbit Hole,6.9,165
5000000,"Comedy, Drama, Crime",Released,'Til death do they party...,Party Monster,5.9,58
5000000,"Horror, Crime, Thriller",Released,One way in. No way out.,Green Room,6.7,683
5000000,"Comedy, Drama, Romance",Released,One woman's story is about to climax.,The Oh in Ohio,5.8,27
5000000,"Drama, Science Fiction, Mystery",Released,Who is John Galt?,Atlas Shrugged Part III: Who is John Galt?,3.9,15
7000000,"Comedy, Crime, Drama",Released,"They're not really criminals, but everyone's got to have a dream.",Bottle Rocket,6.8,281
6000000,"Crime, Drama, Thriller",Released,They Planned The Perfect Crime... Until It All Went Perfectly Wrong!,Albino Alligator,5.6,45
0,"Drama, Foreign, History",Released,To the People...He was a Father. To his Son...he was a Father he never had.,"Gandhi, My Father",6.0,2
0,"Documentary",Released,null,Standard Operating Procedure,6.6,14
0,"Drama",Released,A harrowing drama from the director of Easy Rider,Out of the Blue,6.5,17
5000000,"Comedy, Horror",Released,Evil just messed with the wrong hillbillies.,Tucker and Dale vs Evil,7.3,847
0,"Drama, Romance",Released,"Something mysterious, new, unexpected and lovely is happening to Robert Malone.","Lovely, Still",6.2,13
0,"Action, Drama, Romance",Released,Breath-taking Adventure !,Tycoon,6.6,4
0,"Comedy, Drama",Released,"Once You Get There, You'll Never Want To Leave",Desert Blue,5.5,9
5000000,"Horror, Science Fiction, Thriller",Released,They can seduce anyone... Prey it isn't you!,Decoys,4.7,33
5000000,"Horror, Thriller",Released,No one loves you like your grandparents.,The Visit,6.0,1360
5000000,"Drama, War",Released,null,Redacted,6.2,37
0,"Romance, Thriller",Released,null,Fascination,3.8,4
5000000,"Horror, Thriller, Science Fiction",Released,null,Area 51,4.2,151
5000000,"Thriller",Released,Someone is watching over you,Sleep Tight,7.0,202
0,"Horror, Comedy, Crime, Thriller",Released,Sleeps Six Bloody Comfortably,The Cottage,6.3,80
0,"Drama, Fantasy, Comedy",Released,null,Dead Like Me: Life After Death,5.8,65
0,"Comedy, Documentary",Released,What Happens In Antarctica... Stays in Antarctica,Farce of the Penguins,3.2,13
0,"Drama",Released,It's about the music,Flying By,7.0,2
5000000,"Music, Drama, Comedy",Released,The way back begins with a single chord.,Rudderless,7.4,105
5000000,"Family, Animation",Released,null,Henry & Me,3.0,3
0,"Romance, Comedy",Released,They'll be home for Christmas...if only in their dreams.,Christmas Eve,6.1,24
0,"TV Movie, Crime, Drama, Thriller",Released,null,We Have Your Husband,5.0,3
15000000,"Thriller, Drama",Released,null,Dying of the Light,4.5,118
0,"Action, Thriller, War",Released,null,Born Of War,4.1,7
5000000,"Drama, Action, Thriller, Science Fiction",Released,The mission was a sham. The murders were real.,Capricorn One,6.4,131
0,"Comedy, Drama",Released,Even Shakespeare didn't see this one coming.,Should've Been Romeo,0.0,0
0,"Family",Released,null,Running Forever,0.0,0
5000000,"Comedy, Fantasy, Horror, Thriller",Released,Do your 'wurst...,Yoga Hosers,4.7,102
0,"Horror, Action",Released,null,Navy Seals vs. Zombies,3.5,36
0,"Comedy, Drama",Released,null,I Served the King of England,7.0,22
5000000,"Drama, Comedy",Released,null,Soul Kitchen,7.1,116
1000000,"Drama",Released,A simple man. A difficult choice.,Sling Blade,7.4,231
4798235,"Horror, Thriller",Released,Sometimes dead does not mean gone.,The Awakening,6.3,458
4800000,"Horror",Released,Welcome To Your Worst Nightmare,Hostel,5.7,887
0,"Comedy, Drama",Released,Because everyone loves an accurate period piece.,A Cock and Bull Story,6.2,43
5000000,"Thriller, Drama",Released,null,Take Shelter,7.1,471
0,"Horror, Thriller",Released,"The year is 1962. The place is Willowpoint Falls. Nobody talks about what happened in the school cloakroom 10 years ago. Now, in the dead of night, Frankie Scarlatti is going to find out why.",Lady in White,6.3,25
0,"Drama, Comedy",Released,null,Driving Lessons,6.3,47
5000000,"Comedy",Released,Real Friends Do the Dirty Work.,Let's Kill Ward's Wife,5.5,76
4700000,"Horror",Released,After a decade of silence... The buzzz is back!,The Texas Chainsaw Massacre 2,5.9,139
4638783,"Western",Released,Best of enemies. Deadliest of friends.,Pat Garrett & Billy the Kid,7.2,65
4800000,"Drama, Thriller, Crime",Released,Time to Meet The Devil,Only God Forgives,5.6,862
0,"Drama, Romance",Released,null,Camping Sauvage,4.8,4
4,"Comedy, Romance",Released,null,Without Men,4.6,8
0,"Drama, Family",Released,null,Dear Frankie,7.0,46
0,"Action, Comedy, Drama, Western",Released,null,All Hat,1.0,1
4600000,"Drama, Comedy, Romance",Released,"Make Love, Not War",The Names of Love,7.3,93
4700000,"Drama, Comedy",Released,Mica is a perfectly normal boy. Well he would be if he didn't smell of fish.,Treading Water,5.6,6
4600000,"Drama",Released,Truth is more shocking than fiction.,Savage Grace,5.7,60
0,"Drama",Released,The true story of a small town massacre,Out of the Blue,5.9,18
4500000,"Comedy, Crime",Released,What an Institution!,Police Academy,6.5,602
4500000,"Romance, Adventure, Drama",Released,A sensuous story of natural love.,The Blue Lagoon,5.8,408
6000000,"Comedy, Drama, Romance",Released,Five good reasons to stay single.,Four Weddings and a Funeral,6.6,632
4500000,"Comedy",Released,"Fast Cars, Fast Girls, Fast Carrots...Fast Carrots?",Fast Times at Ridgemont High,7.0,322
4500000,"Adventure, Drama",Released,"From the immortal adventure classic...of whaling men, their ships, and the sea!",Moby Dick,6.9,89
15000000,"Crime, Drama",Released,This life was so close to never happening.,25th Hour,7.2,629
4500000,"Crime, Drama, Romance, Thriller",Released,"In their world, you can't buy freedom, but you can steal it.",Bound,6.9,198
4500000,"Crime, Drama",Released,null,Requiem for a Dream,7.9,2443
0,"Music, Romance",Released,null,State Fair,6.2,19
0,"Drama, Foreign, Romance",Released,Tango: do not ever leave me,Tango,6.8,6
4500000,"Drama",Released,Based on a true story.,Salvador,7.0,71
5000000,"Comedy",Released,What could go wrong?,Moms' Night Out,5.5,121
6000000,"Fantasy, Drama, Mystery",Released,You can never go too far,Donnie Darko,7.7,3452
0,"Action, Comedy, Foreign",Released,null,Saving Private Perez,6.1,18
4500000,"Drama, Foreign, History",Released,null,Character,7.7,25
2000000,"Comedy, Crime, Drama",Released,The ultimate speed freak's tale.,Spun,6.6,132
4500000,"Comedy, Drama",Released,null,Life During Wartime,6.3,30
0,"Drama, Thriller",Released,All she wanted was a peaceful life... they didn't give it.,Sympathy for Lady Vengeance,7.4,356
0,"Drama",Released,null,Mozart's Sister,6.2,13
0,"Comedy, Drama",Released,"It's Not Just About Football, It's About Pride Inside!",Mean Machine,6.0,157
4500000,"Action, Crime, Thriller",Released,null,Exiled,7.0,46
0,"Adventure, Action, Western",Released,No destiny,Blackthorn,6.6,73
0,"Crime, Drama",Released,null,Lilya 4-ever,7.7,139
4500000,"Drama, Horror, Mystery, Thriller",Released,Life is the symptom. Death is the cure.,After.Life,5.4,251
