budget,genres,homepage,id,keywords,original_language,original_title,overview,popularity,production_companies,production_countries,release_date,revenue,runtime,spoken_languages,status,tagline,title,vote_average,vote_count
20000000,"Fantasy, Horror, Action, Thriller, Science Fiction",Released,"In 2019, The Most Precious Natural Resource... Is Us.",Daybreakers,6.0,634
20000000,"Comedy, Romance",Released,"When she's this hot, You get one shot.",She's Out of My League,5.9,525
20000000,"Adventure, Comedy, Romance",Released,She's having the time of someone else's life.,Monte Carlo,6.0,593
9000000,"Horror, Thriller",Released,You die in the game - you die for real.,Stay Alive,5.3,155
0,"Romance, Action, Adventure, Western, Drama",Released,There's a price on his head. A girl on his mind. And a twinkle in his eye.,Quigley Down Under,6.5,119
20000000,"Family, Animation",Released,A Pawsome 3D Adventure,Alpha and Omega,5.3,124
20000000,"Action, Adventure, Fantasy, Horror, Science Fiction, Thriller",Released,Only the power of Hell can help them.,The Covenant,5.2,288
0,"Comedy, Drama",Released,The world of competitive gymnastics is about to be turned on its head.,Stick It,6.3,148
40000000,"Comedy, Family",Released,Not So TALL Tales From The Director Of 'Spy Kids',Shorts,5.1,44
20000000,"Fantasy, Drama, Comedy, Thriller",Released,All she wanted was a little attention.,To Die For,6.7,175
20000000,"Mystery, Adventure, Crime",Released,Are you a watcher or a player?,Nerve,7.1,2181
20000000,"Drama, Western, Crime",Released,Feelings get you killed.,Appaloosa,6.3,299
20000000,"Action, Drama, Fantasy, Horror, Thriller",Released,From the Master of Evil. Comes a New Breed of Terror,Vampires,5.8,255
806948,"Drama, Horror, Thriller",Released,The master of suspense moves his cameras into the icy blackness of the unexplored!,Psycho,8.2,2320
20000000,"Romance, Comedy",Released,It's funny what love can make you do...,My Best Friend's Girl,5.4,220
20000000,"Drama, Romance",Released,Say Goodbye to Innocence,Endless Love,6.7,542
20000000,"Comedy, Drama, Romance",Released,"In this family, attitude doesn't skip a generation.",Georgia Rule,5.6,130
20000000,"Comedy",Released,Who knew so many little people would throw such a huge party?,Under the Rainbow,4.9,7
20000000,"Adventure, Drama, Fantasy, Romance",Released,No force in Heaven will release them. No power on Earth can save them.,Ladyhawke,6.8,260
20000000,"Comedy, Drama, Family",Released,Destiny has big plans for little Simon Birch.,Simon Birch,6.5,52
20000000,"Drama",Released,Let in the unexpected.,Reign Over Me,7.1,334
15000000,"Adventure, Drama",Released,Into the heart. Into the soul.,Into the Wild,7.8,3045
20000000,"Comedy, Drama, Romance",Released,Life's A Game. Learn How To Play.,School for Scoundrels,5.6,111
20000000,"Thriller, Horror, Mystery",Released,This Halloween prepare for a 3D ride through hell.,Silent Hill: Revelation 3D,5.0,432
19000000,"Horror, Action, Thriller, Crime",Released,One night is all that stands between them and freedom. But it's going to be a hell of a night.,From Dusk Till Dawn,6.9,1603
0,"Animation, Family",Released,There's something new in the Hundred Acre Wood.,Pooh's Heffalump Movie,6.4,88
0,"Comedy, Drama, Romance",Released,We'll do it every year..until we get it right,Home for the Holidays,6.3,39
20000000,"Action, Comedy, Crime, Fantasy",Released,So many gangsters...so little time.,Kung Fu Hustle,7.2,831
35000000,"Adventure, Comedy, Family",Released,It's A Bear Getting The Family Together!,The Country Bears,4.3,20
20000000,"Drama",Released,There is a way to be good again.,The Kite Runner,7.3,394
20000000,"Drama, Crime, Thriller",Released,How much does life weigh?,21 Grams,7.2,918
20000000,"Action, Drama, Thriller",Released,One good shot deserves another.,Paparazzi,5.8,52
20000000,"Comedy, Romance",Released,Boy meets girl. Boy meets girl's cousin.,A Guy Thing,5.3,83
0,"Drama, Comedy, Romance, Family",Released,Dare to be different.,Loser,5.0,120
20000000,"Documentary",Released,"Ask not what your C.E.O. can do for you, but what you can do for your C.E.O.",Capitalism: A Love Story,7.0,167
20000000,"Drama, History",Released,null,The Greatest Story Ever Told,6.5,41
19500000,"Crime, Drama, Mystery",Released,The truth lies in the most unexpected places.,Secret in Their Eyes,6.2,336
25000000,"Action, Comedy",Released,Your favorite movies are going to be destroyed.,Disaster Movie,3.0,240
20000000,"Action, Crime, Drama, Thriller",Released,Who will be the last man standing?,Armored,5.5,208
20000000,"Comedy, Thriller, Crime, Action",Released,"He’s on a mission so secret, even he doesn’t know about it.",The Man Who Knew Too Little,6.5,125
20000000,"Comedy, Romance",Released,Ally's looking for the best ex of her life.,What's Your Number?,6.2,671
20000000,"Action, Thriller, Science Fiction",Released,Take no prisoners.,Lockout,5.8,715
40000000,"Comedy",Released,"Success didn’t go to his head, it went to his neighbor.",Envy,4.8,139
20000000,"Action, Thriller, Crime",Released,"Stay Charged, Stay Alive!",Crank: High Voltage,5.9,861
0,"Action, Comedy, Thriller",Released,null,Bullets Over Broadway,7.0,130
20000000,"Drama",Released,Feel The Touch Of Destiny,One Night with the King,6.1,12
30000000,"Drama, Action, Thriller, Romance",Released,null,The Quiet American,6.4,81
20000000,"Comedy, Drama",Released,Dave Spritz is about to take his best shot . . . at life,The Weather Man,6.0,289
20000000,"Action, Adventure, Drama, Thriller",Released,Two Enemies ... The Mob ... The Ultimate Showdown.,Undisputed,6.1,139
0,"Comedy, Fantasy, Romance",Released,He sees dead people... and they annoy him.,Ghost Town,6.4,286
20000000,"Action, Adventure, Drama, Thriller",Released,Survive all 12,12 Rounds,5.7,220
20000000,"Drama, Horror, Mystery",Released,Innocence dies. Abby doesn't.,Let Me In,6.7,641
0,"Adventure, Action, Comedy, Family",Released,"Colt, Rocky and Tum Tum are back for bigger kicks in an all new adventure",3 Ninjas Kick Back,4.5,48
0,"Drama, Comedy",Released,"You name it, we shoot it.",Be Kind Rewind,6.2,424
0,"Comedy, Drama",Released,null,Mrs Henderson Presents,6.4,62
20000000,"Action, Thriller",Released,The Code on the Street is Never Black & White,Triple 9,5.6,797
20000000,"Comedy, Drama",Released,Harry Block has written a best seller... bout his best friends... he revealed their deepest secrets... and they're not pleased... now Harry Block is going to Hell...,Deconstructing Harry,7.3,187
20000000,"Comedy, Romance",Released,All's fair in the war of love.,Three to Tango,5.4,62
20000000,"Drama",Released,Never underestimate a man with everything to lose.,Burnt,6.3,950
20000000,"Comedy, Crime, Drama",Released,Escaped convicts disguised as priests. It'll take a miracle to get away with this one.,We're No Angels,5.6,105
20000000,"Music, Comedy, Romance",Released,null,Everyone Says I Love You,6.5,147
20000000,"Action, Crime, Drama, Thriller",Released,Protect what's yours.,Death Sentence,6.5,297
21000000,"Drama",Released,Frank's travelling light but carrying excess baggage.,Everybody's Fine,6.5,284
0,"Comedy, Family",Released,Meet the new generation of superheroes.,Superbabies: Baby Geniuses 2,1.9,35
0,"Action, Comedy, Crime",Released,One guy walks the walk. The other talks and talks.,The Man,5.4,133
20000000,"Action, Comedy, Crime",Released,null,Code Name: The Cleaner,4.7,78
20000000,"Comedy",Released,"When you follow your dream, there's no telling what you'll become.",Connie and Carla,6.4,24
8000000,"Comedy, Drama, Music, Romance",Released,Love is what it's all about!,Sweet Charity,6.5,15
20000000,"Comedy, Romance, Crime, Drama, Mystery",Released,"Under the paving stones, the beach!",Inherent Vice,6.5,833
0,"Family",Released,Things are about to get hairy.,Doogal,3.2,18
20000000,"Music, Drama",Released,The World is watching,Battle of the Year,5.9,88
20000000,"Comedy, Fantasy",Released,Laugh like you're country depends on it.,An American Carol,4.1,20
12000000,"Action, Crime, Thriller",Released,Trained to kill. Left for dead. Back for more.,Machete Kills,5.3,631
22000000,"Horror",Released,"When the cat's away, the rats will play.",Willard,5.8,82
0,"Comedy",Released,This ain't March of the Penguins.,Strange Wilderness,4.7,69
0,"Comedy, Drama, Music",Released,Gilbert & Sullivan & So Much More,Topsy-Turvy,6.7,41
20000000,"Comedy, Drama, War",Released,Believe the impossible.,Little Boy,7.0,185
15000000,"Drama, Thriller",Released,Why deny what you desire the most.,A Dangerous Method,6.2,571
8700000,"Animation, Science Fiction, Thriller",Released,Everything Is Not Going To Be OK,A Scanner Darkly,6.8,532
0,"Drama",Released,Legends Start Somewhere,Chasing Mavericks,7.0,216
20000000,"Action, Fantasy, Horror, Thriller",Released,Can mankind defeat the army of darkness unleashed by an ancient evil cult?,Alone in the Dark,3.1,173
20000000,"Comedy, Drama, Family, Music",Released,Band Together,Bandslam,5.4,126
20000000,"Drama, Mystery, Thriller",Released,Be careful what you wish for.,Birth,5.9,179
20000000,"Crime, Drama, Thriller",Released,The result is never in question. Just the path you take to get there.,A Most Violent Year,6.5,546
0,"Drama, Romance, War, History",Released,null,Passchendaele,6.3,26
0,"Drama",Released,"Corporations have time, money, and power on their side. All Bob Kearns had was the truth.",Flash of Genius,6.3,59
20000000,"Drama, Music",Released,All I Can Do Is Be Me Whoever That Is,I'm Not There.,6.6,195
20000000,"Action, Thriller",Released,Be careful who you trust.,The Cold Light of Day,4.8,271
20000000,"Adventure, Comedy, Drama, Romance",Released,They'd never let the truth come between them.,The Brothers Bloom,6.8,203
21000000,"Drama",Released,null,"Synecdoche, New York",7.4,278
26500000,"Adventure, Fantasy, Animation",Released,The Fate Of The World Rests On The Courage Of One Warrior.,Princess Mononoke,8.2,1983
0,"Comedy, Drama, Foreign",Released,null,Bon voyage,5.7,20
0,"Comedy, Music",Released,The Musical Comedy Smash of the 80's!,Can't Stop the Music,4.9,9
2000000,"Action, Adventure, Crime, Drama, Thriller, Western",Released,This land will be civilized.,The Proposition,7.1,218
20000000,"Drama",Released,Hope never quits,My All American,6.8,36
20000000,"Comedy",Released,Uptown Gets Down.,Marci X,3.3,12
20000000,"Action, Science Fiction, Thriller",Released,"In a future where freedom is outlawed, outlaws will become heroes.",Equilibrium,6.9,1552
40000000,"Drama, War",Released,"War made them orphans, one man made them legends",The Children of Huang Shi,6.5,52
0,"Drama, Action, Thriller, Crime",Released,He's the target of the most merciless family in New York. His own.,The Yards,6.0,97
0,"Family",Released,null,The Oogieloves in the Big Balloon Adventure,2.2,8
10000000,"Drama, Romance",Released,null,By the Sea,5.4,156
20000000,"Animation, Fantasy, Science Fiction",Released,He will save the future.,Steamboy,6.4,102
0,"Drama",Released,null,The Game of Their Lives,5.8,14
0,"Drama, Mystery, Thriller, Crime, Romance",Released,The perfect love story. Until it became the perfect crime.,All Good Things,5.9,286
20000000,"Adventure",Released,null,Rapa Nui,6.2,33
0,"Comedy, Drama, Family, Fantasy, Science Fiction",Released,It's out of this world.,CJ7,6.1,107
0,"Comedy, Fantasy",Released,They come back!,The Visitors II: The Corridors of Time,5.8,221
20000000,"Action, Comedy, Horror, Mystery, Science Fiction, Thriller",Released,No pulse? No problem,Dylan Dog: Dead of Night,4.5,139
20000000,"Drama, Thriller",Released,null,People I Know,5.5,48
20000000,"Drama, Fantasy",Released,null,The Tempest,6.0,31
0,"Horror, Mystery, Thriller",Released,Fear always finds its victim,Regression,5.3,585
0,"Action, History, Drama",Released,null,Three Kingdoms: Resurrection of the Dragon,6.6,35
20000000,"Crime, Drama, Thriller",Released,Lives will be broken,Butterfly on a Wheel,6.3,130
20000000,"Comedy, Animation, Adventure, Family",Released,Airborne to be wild.,Zambezia,5.3,68
0,"Drama, History",Released,null,Ramanujan,5.0,3
0,"Animation",Released,null,Dwegons,0.5,1
20000000,"Drama",Released,No más. No surrender.,Hands of Stone,6.1,109
20000000,"Thriller",Released,His Next Target is Now Hunting Him,Survivor,5.4,404
27220000,"Thriller, Crime",Released,The hunter becomes the hunted,The Frozen Ground,6.1,465
19400000,"Drama, Romance",Released,Sometimes the greatest journey is the distance between two people.,The Painted Veil,7.1,312
27000000,"Action, Crime, Drama, History, Thriller",Released,null,The Baader Meinhof Complex,7.1,157
22000000,"Adventure, Drama, Western",Released,Inside everyone is a frontier waiting to be discovered.,Dances with Wolves,7.6,1046
20000000,"Comedy",Released,She doesn't give an F.,Bad Teacher,5.4,1584
19000000,"Drama, Crime, Mystery",Released,Deception is dangerous. Desire is deadly.,Sea of Love,6.7,141
19000000,"Comedy",Released,Once upon a time... can happen any time.,A Cinderella Story,6.1,713
14000000,"Crime, Horror, Mystery",Released,Someone has taken their love of scary movies one step too far.,Scream,7.0,1476
0,"Horror, Thriller",Released,"There are ghosts around us all the time. Most of them don't want to hurt us. But, there are exceptions...",Thir13en Ghosts,5.4,440
19000000,"Horror, Thriller",Released,A masterpiece of modern horror.,The Shining,8.1,3757
19000000,"Adventure, Comedy, Science Fiction, Family",Released,He's the only kid ever to get into trouble before he was born.,Back to the Future,8.0,6079
19000000,"Horror, Mystery, Thriller",Released,Evil loves to party.,House on Haunted Hill,5.5,209
0,"Drama, Comedy",Released,null,I Can Do Bad All By Myself,6.0,40
27000000,"Action, Drama",Released,One way in. No way out.,Fight Valley,3.9,8
19000000,"Comedy, Romance, Drama",Released,The most unexpected comedy ever conceived.,The Switch,5.9,583
18000000,"Comedy",Released,Welcome to the honeymoon from hell.,Just Married,5.3,404
19100000,"Drama, Action, Thriller, Crime, War",Released,"The 80's were brilliant, if you were in charge.",The Devil's Double,6.5,208
0,"Animation, Drama, Family, Science Fiction",Released,Little Engines CAN Do Big Things...,Thomas and the Magic Railroad,4.6,8
20000000,"Mystery, Horror, Action",Released,Fear Thy Neighbor,The Crazies,6.2,633
15000000,"Fantasy, Adventure, Animation, Family",Released,The tunnel led Chihiro to a mysterious town...,Spirited Away,8.3,3840
0,"Action, Crime",Released,null,Firestorm,5.9,43
25000000,"Action, Drama, History",Released,"After 200 years, the truth behind the legend.",The Bounty,6.5,108
0,"Drama",Released,Courage beyond words.,The Book Thief,7.4,1486
19000000,"Comedy, Adventure, Romance",Released,He's leaving virgin territory,Sex Drive,6.0,342
19000000,"Romance, Comedy",Released,Anna planned to propose to her boyfriend on February 29th. This is not her boyfriend.,Leap Year,6.4,465
19000000,"Drama, History",Released,The Most Magnificent Re-Creation . . . Of An Ancient Empire . . . Launches A New Epoch In Motion Pictures . . .,The Fall of the Roman Empire,6.0,33
19000000,"Comedy, Drama, Romance",Released,Best. Night. Ever.,Take Me Home Tonight,6.2,208
0,"Drama",Released,If you can't beat the system... change it,Won't Back Down,5.8,40
19000000,"Family, Fantasy, Music",Released,The joy of the New York City Ballet in an exciting family holiday motion picture.,The Nutcracker,5.6,5
18000000,"Thriller, Drama, Music, Crime",Released,"Kansas City, 1934. Anything could happen here. One night it did.",Kansas City,6.1,12
0,"Drama",Released,Based on the novel by Philip Roth.,Indignation,6.8,69
19000000,"Horror, Thriller, Drama",Released,What happened over the next 28 days has never been explained.,The Amityville Horror,6.0,588
19000000,"Comedy, Crime, Drama",Released,"From the creator of Being John Malkovich, comes the story about the creator of Being John Malkovich.",Adaptation.,7.3,638
15000000,"Horror",Released,The dead shall inherit the Earth.,Land of the Dead,6.0,381
0,"Action",Released,null,Out of Inferno,5.8,11
18500000,"Adventure, Drama, Comedy",Released,"Buy the ticket, take the ride.",Fear and Loathing in Las Vegas,7.2,1301
18500000,"Comedy, Romance, Fantasy",Released,In a world where everyone can only tell the truth... This guy can lie.,The Invention of Lying,6.0,518
18000000,"Comedy",Released,Family vs. Frat,Neighbors,6.2,2713
23000000,"Romance, Comedy, Crime, Fantasy",Released,From zero to hero.,The Mask,6.6,2472
18000000,"Fantasy, Drama, Comedy, Romance, Family",Released,You're Only Young Once But For Josh It Might Just Last A Lifetime.,Big,6.9,993
18000000,"Comedy",Released,"Come to Kazakhstan, it's nice!",Borat: Cultural Learnings of America for Make Benefit Glorious Nation of Kazakhstan,6.5,1579
18000000,"Comedy",Released,Don't judge a book by its hair color!,Legally Blonde,6.1,882
18000000,"Science Fiction, Action, Adventure, Thriller",Released,A dying planet. A fight for life.,Star Trek III: The Search for Spock,6.4,434
19000000,"Crime, Drama, Horror, Thriller",Released,What happened to Emily?,The Exorcism of Emily Rose,6.3,659
17000000,"Comedy",Released,He charges $10 but he’s willing to negotiate.,Deuce Bigalow: Male Gigolo,5.5,308
16000000,"Thriller, Action, Science Fiction",Released,The End Begins,Left Behind,3.7,392
0,"Comedy, Drama, Romance",Released,Feel The Love,The Family Stone,6.2,249
18000000,"Comedy, Drama",Released,Let your hair down,Barbershop 2:  Back in Business,5.6,74
23000000,"Drama, Comedy, Crime",Released,He doesn't care if you're naughty or nice.,Bad Santa,6.5,656
16500000,"Science Fiction, Comedy, Crime",Released,"If he were any cooler, he'd still be frozen, baby!",Austin Powers: International Man of Mystery,6.5,1013
18000000,"Romance, Comedy, Family",Released,People change. Greeks don't.,My Big Fat Greek Wedding 2,5.5,322
21000000,"Family, Comedy",Released,Welcome to the next grade,Diary of a Wimpy Kid: Rodrick Rules,6.3,238
18000000,"Science Fiction, Action, Adventure, Thriller",Released,"If it bleeds, we can kill it...",Predator,7.3,2093
18000000,"Drama, History, Music",Released,...Everything you've heard is true,Amadeus,7.8,1076
0,"Crime, Horror",Released,A Night To Die For.,Prom Night,4.8,167
17000000,"Comedy",Released,Welcome to girl world.,Mean Girls,6.9,2320
0,"Comedy, Drama, Romance",Released,Life offers you a thousand chances ... all you have to do is take one.,Under the Tuscan Sun,6.4,172
19800000,"Drama, Mystery, Thriller",Released,Tea at four. Dinner at eight. Murder at midnight.,Gosford Park,6.8,246
18000000,"Comedy, Drama, Fantasy, Romance",Released,"Knowing what you know now, what would you do differently?",Peggy Sue Got Married,5.9,136
18000000,"Drama, Comedy",Released,or (The Unexpected Virtue of Ignorance),Birdman,7.4,4535
18000000,"Comedy, Drama",Released,Blue Moon. I used to know the words. Now they're all a jumble.,Blue Jasmine,7.0,1098
15000000,"Drama, History, Crime, Thriller, Action",Released,"September 11, 2001. Four planes were hijacked. Three of them reached their target. This is the story of the fourth.",United 93,6.9,367
18000000,"Romance, Music, Family",Released,Her dream. Her terms,Honey,6.0,303
18000000,"Action, Comedy",Released,All the action. All the women. Half the intelligence.,Spy Hard,4.9,147
1000000,"Horror",Released,Lock your doors. Bolt your windows. There's something in THE FOG!,The Fog,6.4,311
18000000,"Action, Drama",Released,"When you come back from a loss, beat the odds, and never say never, you find a champion.",Soul Surfer,6.9,342
18000000,"War, Comedy, Drama",Released,null,Catch-22,6.7,72
0,"Comedy, Crime, Drama",Released,"Right now, the world needs a hero.",Observe and Report,5.6,225
18000000,"Adventure, Fantasy, Action",Released,The most powerful legend of all is back in a new adventure.,Conan the Destroyer,5.8,383
18000000,"Drama",Released,null,Raging Bull,7.7,938
18000000,"Drama, Romance",Released,Sometimes when you least expect it...,Love Happens,5.6,180
18000000,"Action, Adventure, Crime, Drama, Family, Mystery, Thriller",Released,"Before a lifetime of adventure, they lived the adventure of a lifetime.",Young Sherlock Holmes,6.7,167
0,"Music, Comedy, Drama, Romance",Released,null,Fame,5.5,135
18000000,"Adventure, Drama, Thriller",Released,There is no force more powerful than the will to live.,127 Hours,7.0,2606
0,"Action, Comedy, Crime",Released,They took a bite out of crime,Small Time Crooks,6.4,155
18000000,"Drama, Music",Released,Life doesn't hold tryouts.,Center Stage,6.8,90
17000000,"Comedy, Family",Released,"Christmas means comfort, joy and chaos.",Love the Coopers,5.4,167
18000000,"Family, Action, Adventure",Released,They're on a mission without permission.,Catch That Kid,4.9,76
18000000,"Drama",Released,"Seen from a distance, it's perfect.",Life as a House,7.2,120
30000000,"Drama, History",Released,Can a great man be a good man?,Steve Jobs,6.8,1573
18000000,"Comedy, Romance",Released,Popularity is nice. Popular girls are not.,"I Love You, Beth Cooper",5.1,197
18000000,"Drama, Comedy, Romance",Released,"Every ""Revolution"" Needs A Leader",Youth in Revolt,5.9,319
18000000,"Action, Adventure, Romance, Western",Released,"The untold story of the man behind the mask, and the legend behind the man.",The Legend of the Lone Ranger,3.7,14
21000000,"Drama, Thriller",Released,"In a place this treacherous, what a good spy needs is a spy of his own.",The Tailor of Panama,6.2,92
18000000,"Drama, Mystery, Thriller",Released,Murder has a sound all of its own!,Blow Out,7.3,236
18000000,"Action, Crime",Released,Get in. Get out. Getaway.,Getaway,4.9,246
18000000,"Drama",Released,"It was 1973, and the climate was changing.",The Ice Storm,6.9,176
18000000,"Comedy, Drama, Romance",Released,null,And So It Goes,5.7,164
0,"Adventure, Comedy, Family",Released,"When the going gets tough, the tough go shopping!",Troop Beverly Hills,5.6,56
0,"Comedy, Drama, Romance",Released,Passion. Obsession. Revenge. Prepare for the performance of a lifetime.,Being Julia,6.4,23
17000000,"Drama, Romance",Released,They Broke Every Rule,Nine 1/2 Weeks,5.8,177
18000000,"Fantasy",Released,"In the Dark Ages, Magic was a weapon. Love was a mystery. Adventure was everywhere... And Dragons were real.",Dragonslayer,6.5,67
0,"Drama, Romance",Released,Intoxicating. Infuriating. Impossible. Love.,The Last Station,6.7,55
18000000,"Comedy, Drama, History",Released,"When it came to making bad movies, Ed Wood was the best.",Ed Wood,7.3,630
18000000,"Drama",Released,null,Labor Day,6.7,299
18000000,"History",Released,Greatness comes to those who take it.,Mongol: The Rise of Genghis Khan,6.5,158
18000000,"Action, Crime, Thriller",Released,"A story of sex, thugs and rock 'n roll.",RockNRolla,6.9,836
0,"Adventure, Action, Science Fiction",Released,Deeds not Words,Megaforce,3.5,15
0,"Drama",Released,null,Hamlet,7.3,117
25000000,"Drama, Romance",Released,最后的舞者,Mao's Last Dancer,6.8,28
18000000,"Adventure, Drama, Science Fiction",Released,He's not like us.,Midnight Special,6.2,694
0,"Comedy, Romance",Released,In any relationship one person always does the heavy lifting.,Anything Else,6.2,149
18000000,"Drama, History",Released,Revenge is never a straight line.,The Railway Man,6.7,273
15238800,"Crime, Drama, Mystery",Released,null,The White Ribbon,7.2,255
0,"Horror",Released,null,Restoration,5.3,11
2700000,"Romance, Science Fiction, Horror, Action, Crime",Released,He's not from around here...,The Wraith,5.9,108
18000000,"Drama, Mystery, Thriller",Released,"If you're looking for the truth, you've come to the wrong place.",Salton Sea,7.0,104
18000000,"Music",Released,Experience Metallica like never before,Metallica: Through the Never,6.7,83
18000000,"Drama",Released,Greed is good. Sex is easy. Youth is forever.,The Informers,4.4,60
18000000,"Crime, Drama, Thriller, History",Released,The man who hijacked the world,Carlos,6.7,50
18000000,"Thriller, Drama",Released,null,I Come with the Rain,5.6,20
0,"Western, Action, Drama, History",Released,One man's hero is another man's traitor.,One Man's Hero,9.3,2
3500000,"Horror, Science Fiction",Released,The darkest day of horror the world has ever known.,Day of the Dead,6.9,270
18000000,"Action, Crime, Drama, Thriller",Released,I lay my vengeance upon them.,I Am Wrath,4.5,179
18000000,"Action, Animation, Science Fiction",Released,Paris 2054. Live forever or die trying,Renaissance,6.7,77
17900000,"Adventure, Fantasy, Action",Released,A woman and a warrior that became a legend.,Red Sonja,5.0,206
14000000,"Thriller",Released,How much do you want to believe?,Red Lights,6.0,376
20000000,"Comedy",Released,Come and Get Some!,Superbad,7.0,2100
0,"Comedy, Crime, Drama",Released,null,Madea Goes to Jail,6.4,52
18000000,"Horror, Action",Released,Unleash the beast,Wolves,5.7,82
23000000,"Music, Drama, Romance",Released,It's not where you're from. It's where you're at.,Step Up 2: The Streets,6.5,640
15000000,"Animation, Comedy, Family",Released,Armed And Dangerously Dumb.,Hoodwinked!,5.9,479
17500000,"Drama, History, War",Released,"When the world closed its eyes, he opened his arms.",Hotel Rwanda,7.5,793
24000000,"Action, Crime, Drama, Thriller",Released,Assassin 47,Hitman,5.9,966
17500000,"Drama, Music",Released,The Musical Event of the Holiday Season,Black Nativity,5.8,16
18000000,"Thriller, Action",Released,Mercy is for the Weak,The Prince,4.6,218
0,"Thriller",Released,null,City of Ghosts,5.4,18
0,"Horror, Drama, Mystery, Thriller",Released,"Sooner or later she'll see them, then everything will be different.",The Others,7.4,1660
18500000,"Horror, Action, Thriller, Science Fiction",Released,This Time It's War,Aliens,7.7,3220
17000000,"Drama, Family, Music, Romance",Released,The loverliest motion picture of them all!,My Fair Lady,7.4,352
17000000,"Horror, Thriller, Mystery",Released,"If you're going to bury the truth, make sure it stays buried.",I Know What You Did Last Summer,5.6,687
17000000,"Comedy",Released,Fake Cops. Real Trouble.,Let's Be Cops,6.4,1219
16000000,"Comedy, Drama, Romance",Released,In search of wine. In search of women. In search of themselves.,Sideways,6.9,478
