budget,genres,homepage,id,keywords,original_language,original_title,overview,popularity,production_companies,production_countries,release_date,revenue,runtime,spoken_languages,status,tagline,title,vote_average,vote_count
50000000,"Fantasy, Horror, Action",Released,Classic tale. New twist.,Hansel & Gretel: Witch Hunters,5.7,3239
50000000,"Thriller, Drama",Released,Where do you go when you've gone too far?,Unfaithful,6.3,276
50000000,"Action, Thriller, Science Fiction, Adventure",Released,Three like him have already been killed…he is Number Four.,I Am Number Four,5.9,1567
50000000,"Drama, Thriller",Released,Everything is connected.,Syriana,6.3,451
50000000,"Action, Drama, History, Thriller, War",Released,"When everything went wrong, six men had the courage to do what was right.",13 Hours: The Secret Soldiers of Benghazi,7.0,938
50000000,"Romance, Animation, Adventure, Comedy, Family, Fantasy",Released,null,The Book of Life,7.3,755
45000000,"Thriller",Released,Nothing Is More Dangerous Than A Man With Everything To Lose.,Firewall,5.6,267
50000000,"Crime, Drama, Thriller",Released,Corrupts Absolutely.,Absolute Power,6.4,223
50000000,"Action, Drama",Released,Failure is not an option.,G.I. Jane,6.0,395
50000000,"Drama, Thriller, Mystery",Released,What do you get for the man who has everything?,The Game,7.5,1506
50000000,"Horror, Mystery",Released,We've been expecting you.,Silent Hill,6.3,1067
0,"Comedy",Released,Throw the ball. Catch the girl. Keep it simple.,The Replacements,6.1,203
50000000,"Comedy",Released,Save the best piece for last.,American Reunion,6.1,1611
50000000,"Action, Adventure, Crime, Drama, Mystery, Thriller",Released,He frees hostages for a living. Now he's taking hostages to survive.,The Negotiator,6.8,582
50000000,"Action, Thriller",Released,Prepare to go,Into the Storm,5.8,817
50000000,"Action, Comedy, Crime",Released,null,Beverly Hills Cop III,5.5,434
50000000,"Comedy, Horror, Fantasy",Released,Here they grow again.,Gremlins 2: The New Batch,6.2,652
50000000,"Drama",Released,Defend your Honor.,The Judge,7.2,1417
50000000,"Action, Thriller",Released,How do you get the world's attention?,The Peacemaker,5.8,255
45000000,"Horror, Action, Science Fiction",Released,You're all going to die.,Resident Evil: Apocalypse,6.1,1267
50000000,"Comedy, Romance",Released,Same Bridget. Brand new diary.,Bridget Jones: The Edge of Reason,6.1,750
50000000,"Thriller, Crime, Drama",Released,The Clock Is Ticking...,Out of Time,6.1,298
50000000,"Action, Thriller",Released,His Battle To Save The Alaskan Wilderness And Protect Its People Can Only Be Won...,On Deadly Ground,4.5,104
50000000,"Adventure, Family, Science Fiction",Released,Smaller heroes. Just as super.,The Adventures of Sharkboy and Lavagirl,4.4,269
40000000,"Drama, Adventure, Romance, Thriller",Released,Somewhere on this planet it must exist.,The Beach,6.3,1233
50000000,"Drama, Comedy, Romance",Released,Her uptown life gets turned inside out!,Raising Helen,5.9,189
40000000,"Action, Crime, Thriller",Released,"Fear not the weapon, but the hand that wields it.",Ninja Assassin,6.2,371
50000000,"Drama, Romance",Released,Billy Chapel must choose between the woman he loves and the game he lives for.,For Love of the Game,6.3,88
50000000,"Drama, Thriller, Crime",Released,Some People Get Into Trouble No Matter What They WEAR.,Striptease,4.4,205
50000000,"Family, Comedy",Released,Live Large,Marmaduke,5.0,149
50000000,"Drama, Fantasy",Released,Touched by death. Changed by life.,Hereafter,5.8,510
50000000,"Crime, Drama, Thriller",Released,The only flaw in their plan was her.,Murder by Numbers,6.0,268
50000000,"Action, Adventure, Crime, Thriller",Released,"In the shadows of life, In the business of death, One man found a reason to live...",Assassins,6.0,387
50000000,"Crime, Drama, Thriller",Released,It started with revenge.,Hannibal Rising,6.0,654
50000000,"Comedy, Drama, Romance",Released,null,The Story of Us,5.9,75
44000000,"Action, Adventure, Romance, Science Fiction, Thriller",Released,You will be one of us,The Host,6.0,1817
50000000,"Action, Drama, Mystery, Thriller, Crime",Released,Deception is their most deadly weapon.,Basic,6.2,286
50000000,"Crime, Drama, Mystery, Thriller",Released,He's a heartbeat away from catching the killer,Blood Work,6.1,206
50000000,"Drama, Thriller, Crime",Released,Is your money making a killing?,The International,6.0,368
50000000,"Action, Adventure, Science Fiction, Thriller",Released,Snake Is Back.,Escape from L.A.,5.6,373
70000000,"Adventure, Animation, Family, Fantasy, Science Fiction",Released,It came from outer space!,The Iron Giant,7.6,1436
50000000,"Adventure, Comedy, Drama",Released,"The deeper you go, the weirder life gets.",The Life Aquatic with Steve Zissou,7.1,775
50000000,"War, Action, Drama, History, Thriller",Released,Based on the incredible true story.,Free State of Jones,6.6,428
50000000,"Drama, Thriller, Crime",Released,The crime is clear. The truth is not.,The Life of David Gale,7.3,480
40000000,"Comedy, Action",Released,Protecting witnesses is a challenge. Living with them is impossible.,Man of the House,5.4,120
50000000,"Action, Crime, Drama, Mystery, Thriller",Released,No sin goes unpunished,Run All Night,6.3,1148
51500000,"Thriller, Crime, Mystery",Released,Every sin leaves a mark.,Eastern Promises,7.2,848
50000000,"Action, Thriller, Adventure, Crime",Released,Treasure has its price.,Into the Blue,5.8,458
60000000,"Adventure, Drama, Action, History, War",Released,null,The Messenger: The Story of Joan of Arc,6.2,367
49900000,"Comedy",Released,Get your quest on.,Your Highness,5.2,501
50000000,"Drama, Thriller, Mystery",Released,"Once upon a time, there were two little girls who lived in a house.",Dream House,5.8,391
50000000,"Action, Drama, Thriller",Released,One man will make a mistake. The other will make it a spectacle.,Mad City,5.9,81
50000000,"Action, Adventure, Comedy, Family",Released,No bib. No crib. No problem.,Baby's Day Out,5.8,274
50000000,"Drama, History, Romance",Released,"When intimacy is forbidden and passion is a sin, love is the most defiant crime of all.",The Scarlet Letter,5.5,108
22000000,"Drama, Thriller",Released,Wife. Mother. Spy.,Fair Game,6.5,235
50000000,"Action, Crime",Released,Heads You Live... Tails You Die.,Domino,6.0,444
50000000,"Action, Thriller, Mystery, Romance",Released,Some fantasies go too far.,Jade,5.2,44
50000000,"Action, Thriller, Science Fiction",Released,"In the near future, you don't live to play... you'll play to live.",Gamer,5.6,760
60000000,"Fantasy, Drama, Romance",Released,Dark secrets will come to light.,Beautiful Creatures,5.6,984
55000000,"Comedy, Crime, Drama, Thriller",Released,Get ready for an unexpected hit.,Death to Smoochy,5.9,132
50000000,"Comedy",Released,Long time no Z,Zoolander 2,4.7,797
50000000,"Comedy, Crime",Released,It's all in who you trust,The Big Bounce,5.0,76
60000000,"Comedy, Drama, Romance, Science Fiction",Released,"To save his planet, an alien must find a woman on Earth to have his baby. There's just one problem.",What Planet Are You From?,5.4,37
50000000,"Fantasy, Thriller, Action, Crime",Released,One hell of a ride.,Drive Angry,5.3,600
50000000,"Action, Adventure, Science Fiction, Thriller",Released,Some fight for power. Some fight for us.,Street Fighter: The Legend of Chun-Li,3.9,112
49000000,"Action, Science Fiction, Thriller",Released,Stealing the power of the universes one by one.,The One,5.7,437
49000000,"Action, Comedy, Thriller, Crime, Mystery",Released,Kojak. Columbo. Dirty Harry. Wimps.,The Adventures of Ford Fairlane,6.2,71
50000000,"Drama, Comedy",Released,On air. Off shore. Out of control.,The Boat That Rocked,7.2,666
48000000,"Thriller, Drama, Crime",Released,No one gets away clean,Traffic,6.9,562
48000000,"Adventure, Action",Released,"The man with the hat is back. And this time, he's bringing his Dad.",Indiana Jones and the Last Crusade,7.6,3152
0,"Drama, Romance",Released,An epic story of love.,Anna Karenina,6.5,639
49000000,"Crime, Action, Science Fiction",Released,I am consciousness. I am alive. I am Chappie.,Chappie,6.6,3062
73000000,"Drama, Mystery, Thriller, Crime",Released,Serial killer vs. forensic genius,The Bone Collector,6.5,826
48000000,"Crime, Drama, Thriller",Released,null,Panic Room,6.5,1267
0,"Horror",Released,null,The Tooth Fairy,4.3,13
75000000,"Action, Adventure, Comedy",Released,It's good to be King.,Three Kings,6.6,692
50000000,"Crime, Thriller",Released,How do you find a killer who doesn’t exist?,Child 44,6.1,547
48000000,"Adventure, Comedy",Released,563 miles. 9 people. $2 million. 1001 problems!,Rat Race,6.0,518
48000000,"Drama, Science Fiction",Released,Change the way you look at the world.,K-PAX,7.1,695
0,"Comedy, Fantasy, Romance, Science Fiction",Released,If they lived in the same century they'd be perfect for each other.,Kate & Leopold,6.0,418
48000000,"Fantasy, Comedy, Romance",Released,Meet the Devil. She's giving Elliott seven wishes. But not a chance in Hell.,Bedazzled,5.6,512
58000000,"Music, Drama, Crime, Romance",Released,It was the jazz age. It was an era of elegance and violence. The action was gambling. The stakes were life and death.,The Cotton Club,6.6,68
55000000,"Western",Released,Time waits for one man.,3:10 to Yuma,6.9,1188
48000000,"Thriller, Action",Released,It Ends Here,Taken 3,6.1,2200
48000000,"Romance, Comedy, Crime",Released,Opposites attract.,Out of Sight,6.5,333
47000000,"Comedy, Drama, Thriller",Released,There's no such thing as free cable.,The Cable Guy,5.7,594
0,"Drama",Released,null,Earth,6.6,9
47000000,"Adventure, Action, Comedy, Thriller, Crime",Released,Their turf. Their game. Their rules. They didn't count on HIS law...,Dick Tracy,5.9,251
48000000,"Drama, Crime, Romance",Released,How do you get the man who has everything?,The Thomas Crown Affair,6.6,339
48000000,"Comedy, Drama, Romance",Released,One day can make your life; one day can ruin your life. All life is is four or five big days that change everything.,Riding in Cars with Boys,6.5,103
15000000,"Action, Adventure, Thriller, War",Released,This time he's fighting for his life.,First Blood,7.2,1488
0,"Drama, Science Fiction, Adventure, Mystery",Released,null,Solaris,7.7,357
47000000,"Animation, Comedy, Family, Fantasy, Science Fiction",Released,Fairy Tale Endings Aren't What They Used To Be,Happily N'Ever After,4.6,104
47000000,"Drama, Horror, Thriller, Romance",Released,The untold story of Jekyll and Hyde,Mary Reilly,5.7,74
38000000,"Comedy, Romance",Released,It's about finding the love of your life. And deciding what to do about it.,My Best Friend's Wedding,6.3,584
0,"Comedy, Romance",Released,Hollywood's hottest couple just split up. It'll take more than special effects to reunite them.,America's Sweethearts,5.5,252
46000000,"Crime, Mystery, Thriller",Released,A tough cop. A brilliant killer. An unspeakable crime.,Insomnia,6.8,1148
46000000,"Science Fiction, Action, Adventure, Thriller",Released,Resistance is futile.,Star Trek: First Contact,7.0,661
47000000,"Action, Western, Drama, Fantasy, Thriller",Released,Revenge gets ugly.,Jonah Hex,4.4,420
46000000,"Drama, Thriller, Mystery, War",Released,A medal for honor. A search for justice. A battle for truth.,Courage Under Fire,6.2,232
45000000,"Comedy",Released,Trust me.,Liar Liar,6.4,1424
25000000,"Crime, Drama, Thriller",Released,The true story of one man against the biggest drug cartel in history.,The Infiltrator,6.6,573
46000000,"Drama, History, War",Released,LOVE. DESTINY. HEROES. War Changes Everything.,Inchon,6.5,2
46000000,"Fantasy, Comedy, Family",Released,Yabba-Dabba-Doo!,The Flintstones,5.0,543
45000000,"Action, Crime, Thriller",Released,First they took his daughter. Now they're coming for him.,Taken 2,6.1,2757
48000000,"Comedy",Released,Great trilogies come in threes.,Scary Movie 3,5.8,912
45000000,"Comedy, Crime, Action",Released,Never Mess With An Agent In A Dress.,Miss Congeniality,6.1,961
45000000,"Action, Science Fiction, Adventure, Comedy, Family",Released,Same Planet. Different World.,Journey to the Center of the Earth,5.8,1309
40000000,"Comedy, Drama, Family, Romance",Released,It can take a lifetime to find true love; she's got 30 days!,The Princess Diaries 2: Royal Engagement,6.0,697
45000000,"Drama, Mystery, Thriller, Crime",Released,Two Supreme Court Justices have been assassinated. One lone law student has stumbled upon the truth. An investigative journalist wants her story. Everybody else wants her dead.,The Pelican Brief,6.3,371
45000000,"Drama, Thriller, Crime, Mystery",Released,A district attorney out for a conviction. A new lawyer out of her league. A young boy who knew too much.,The Client,6.4,278
45000000,"Drama, Comedy",Released,Find the joy.,The Bucket List,7.0,1111
45000000,"Drama, Action, Thriller, Crime",Released,Not for honor. Not for country. For his wife and child.,Patriot Games,6.3,433
43000000,"Romance, Comedy",Released,This relationship is going to be a real mother.,Monster-in-Law,5.6,406
46000000,"Drama, Thriller, Crime",Released,Every moment matters.,Prisoners,7.9,3085
45000000,"Action, Crime, Drama, Thriller",Released,"The only thing more dangerous than the line being crossed, is the cop who will cross it.",Training Day,7.3,1634
45000000,"Comedy, Family, Science Fiction",Released,A comedy of Galactic Proportions.,Galaxy Quest,6.9,710
45000000,"Comedy",Released,No More Mercy. No More Shame. No More Sequels - Honest! - We Lied.,Scary Movie 2,5.4,982
45000000,"Comedy, Family, Music",Released,They're closer than you think.,The Muppets,6.5,501
45000000,"Horror, Action",Released,Part Man. Part Vampire. All Hero.,Blade,6.5,1905
30000000,"Drama",Released,It begins on the street. It ends here.,Coach Carter,7.3,496
45000000,"Action, Adventure, Crime, Thriller",Released,"An ambitious lawyer, a desperate father, they had no reason to meet, until today,",Changing Lanes,5.9,299
45000000,"Adventure, Horror, Thriller",Released,When You Can't Breathe You Can't Scream.,Anaconda,4.7,610
45000000,"Comedy",Released,This party never ends.,Coyote Ugly,5.8,575
40000000,"Comedy, Romance, Drama",Released,The ultimate romantic comedy.,Love Actually,7.0,1869
120000000,"Adventure, Animation, Comedy, Family",Released,An epic presentation of miniature proportions.,A Bug's Life,6.8,2303
35000000,"Horror, Mystery, Thriller",Released,Only the legend will survive.,From Hell,6.6,741
45000000,"Action, Thriller",Released,The government taught him to kill. Now he's using his skills to help a woman seek revenge against the Miami underworld.,The Specialist,5.5,313
45000000,"Comedy, Drama, Romance",Released,Golf Pro. Love Amateur.,Tin Cup,5.9,150
0,"Comedy, Drama, Family",Released,Their wedding night set new attendence records,"Yours, Mine and Ours",6.2,26
45000000,"Romance, Comedy, Family",Released,One man could lead this team to glory. . . That man was busy,Kicking & Screaming,5.6,176
50000000,"Adventure, Comedy, Family, Science Fiction",Released,Don't leave Earth without it.,The Hitchhiker's Guide to the Galaxy,6.6,1315
0,"Comedy, Drama, Family",Released,null,Fat Albert,4.3,69
45000000,"Horror, Action, Science Fiction",Released,The Extinction Is Coming...,Resident Evil: Extinction,6.1,1292
40000000,"Comedy",Released,"Single Dad, No Clue. Single Mum, Flying Solo.",Blended,6.6,1006
45000000,"Adventure, Comedy, Drama",Released,She always thought she was somebody special... and she was.,Last Holiday,6.4,119
45000000,"Action, Adventure, Crime, Thriller",Released,The vacation is over,The River Wild,6.1,210
45000000,"Adventure, Family, Fantasy",Released,null,The Indian in the Cupboard,5.9,134
45000000,"Crime, Drama, Thriller",Released,Young Beautiful Deadly.,Savages,6.2,766
25000000,"Action, Adventure, Crime, Thriller",Released,If the signal dies so does she,Cellular,6.1,537
40000000,"Adventure, Action, Comedy",Released,"He knows no fear, he knows no danger, he knows nothing.",Johnny English,6.0,852
50000000,"Fantasy, Adventure, Animation, Comedy, Family",Released,The battle for the lawn is on.,The Ant Bully,5.5,366
40000000,"Action, Science Fiction, Adventure",Released,"A world beyond your experience, beyond your imagination.",Dune,6.5,562
0,"Adventure, Drama, Music, Romance",Released,All you need is love.,Across the Universe,7.1,410
35000000,"Drama, Romance",Released,How do you break free without breaking apart?,Revolutionary Road,6.7,796
55000000,"Action, Adventure, Crime, Thriller",Released,"For a New York cop and his witness, the distance between life and death just got very short.",16 Blocks,6.2,661
70000000,"Action, Adventure, Science Fiction, Thriller",Released,Kill or be Killed.,Babylon A.D.,5.4,676
45000000,"Action, Adventure, Crime, Drama, Thriller",Released,Two good cops. One bad situation.,The Glimmer Man,4.7,100
45000000,"Comedy, Fantasy, Science Fiction",Released,"Sometimes to get more out of life, you have to make more of yourself.",Multiplicity,5.5,154
45000000,"Adventure, Comedy, Family, Fantasy, Science Fiction",Released,The aliens vs. the Pearsons,Aliens in the Attic,5.3,244
35000000,"Crime, Drama, Mystery, Thriller",Released,null,The Pledge,6.5,215
45000000,"Comedy, Music",Released,null,The Producers,6.1,151
45000000,"Adventure, Action",Released,Slam Evil!,The Phantom,4.7,136
57000000,"Drama, Romance, Western",Released,Some passions can never be tamed.,All the Pretty Horses,5.8,60
44000000,"History, Drama",Released,"Triumphant in Victory, Bitter in Defeat. He Changed the World, But Lost a Nation.",Nixon,7.1,71
45000000,"Thriller, Mystery",Released,Read between the lies.,The Ghost Writer,6.7,670
45000000,"Adventure, Action, Horror, Science Fiction",Released,Full Scream Ahead,Deep Rising,6.0,154
45000000,"Drama, War",Released,null,Miracle at St. Anna,6.3,90
110,"Action, Drama, Fantasy",Released,Unspeakable secrets are hidden within the Forbidden City.,Curse of the Golden Flower,6.6,203
45000000,"Action, Crime, Thriller",Released,There's only one way out.,Bangkok Dangerous,5.0,332
40000000,"Action, Comedy, Thriller",Released,They have forty-five minutes to save the world. They need forty-six.,Big Trouble,6.3,80
45000000,"Drama, Romance",Released,How long would you wait for love?,Love in the Time of Cholera,6.4,81
45000000,"Action, Thriller",Released,null,Shadow Conspiracy,4.0,11
45000000,"Crime, Adventure, Action, Comedy, Thriller",Released,One man. One mission. No chance.,Johnny English Reborn,6.0,1007
65000000,"Animation, Action, Comedy, Family",Released,When good food... goes bad!,Foodfight!,2.3,28
44500000,"Drama, Thriller",Released,The movie was fake. The mission was real.,Argo,7.1,3423
44000000,"Adventure, Action, Thriller, Crime, Mystery",Released,A murdered wife. A one-armed man. An obsessed detective. The chase begins.,The Fugitive,7.2,1220
40000000,"Action",Released,"It's a Job. It Isn't Personal. Well, Maybe a Little...",The Bounty Hunter,5.5,858
44000000,"Crime, Drama, Thriller",Released,When friendship runs deeper than blood.,Sleepers,7.3,715
44000000,"Action, Adventure, Thriller, War",Released,"What most people call hell, he calls home.",Rambo: First Blood Part II,6.3,864
44000000,"Drama, Thriller",Released,There is no defense.,The Juror,5.5,89
2600000,"Animation, Family",Released,For anyone who has ever wished upon a star.,Pinocchio,6.9,1355
44000000,"Action, Drama, History, Western",Released,The only thing greater than their passion for America... was their passion for each other.,Heaven's Gate,6.4,55
50000000,"Fantasy, Action, Science Fiction, Thriller",Released,"My God. Brother, what have you done?",Underworld: Evolution,6.4,1528
40000000,"Drama, Science Fiction, Thriller",Released,Discover the origin of the monster and his creation.,Victor Frankenstein,5.6,685
43000000,"Drama",Released,"In an ordinary place, he found the one person to make his life extraordinary.",Finding Forrester,7.0,302
43000000,"Comedy, Drama",Released,The Life of the Party... before she got a life.,28 Days,6.0,208
45000000,"Action, Crime",Released,Serve No Master,Unleashed,6.6,518
43000000,"Romance, Comedy",Released,A romantic comedy without the sugar.,The Sweetest Thing,5.3,280
42000000,"Drama, Mystery, Thriller",Released,Power can be murder to resist.,The Firm,6.6,501
44000000,"Drama",Released,Life is for living.,Charlie St. Cloud,6.8,566
40000000,"Action, Thriller, Crime",Released,Someone has to fix the problems.,The Mechanic,6.3,1045
42000000,"Action, Comedy, Crime",Released,They thought the streets were mean. Then they went back to high school.,21 Jump Street,6.7,4074
42000000,"Romance, Comedy, Drama",Released,Can the most famous film star in the world fall for the man on the street?,Notting Hill,7.0,1262
45000000,"Animation, Comedy, Family",Released,This ain't no chick flick. It's poultry in motion.,Chicken Run,6.5,1150
42000000,"Comedy, Romance",Released,"For the most cautious man on Earth, life is about to get interesting.",Along Came Polly,5.8,773
40000000,"Comedy, Romance",Released,A Player Who's About to be Played.,Boomerang,5.4,134
43000000,"Action, Comedy, Crime",Released,Action's never been so hot!,The Heat,6.5,1575
31115000,"Drama, History, Romance",Released,The motion picture the world has been waiting for!,Cleopatra,6.7,146
0,"Comedy",Released,No one will fight for his students like Mr. Voss.,Here Comes the Boom,6.0,593
42000000,"Drama, Mystery, Thriller, Crime",Released,Everything you trust. Everything you know. May be a lie...,High Crimes,6.1,184
42000000,"Comedy, Drama, Romance",Released,A story about just how wrong two people can be before they can be right.,The Mirror Has Two Faces,6.5,47
32000000,"Drama, Horror, Mystery",Released,What do you see?,The Mothman Prophecies,6.1,305
42000000,"Comedy",Released,Borat was so 2006,Brüno,5.4,518
32000000,"Adventure, Action, Thriller",Released,His bad side is a dangerous place to be.,Licence to Kill,5.9,541
42000000,"Fantasy, Thriller, Horror",Released,Who's afraid?,Red Riding Hood,5.6,922
60000000,"Action, Crime, Thriller",Released,America Likes to Watch,15 Minutes,5.7,191
48000000,"Adventure, Comedy, Family, Fantasy",Released,This Ain't No Game.,Super Mario Bros.,4.0,232
42000000,"Crime, Drama, Thriller",Released,"Where there's a will, there's a weapon",Lord of War,7.0,1335
31000000,"Drama, Adventure, Action, History",Released,One man's strength will unite an empire.,Hero,7.2,635
40000000,"Action, Comedy, Crime",Released,She's looking for a few not-so-good men,One for the Money,5.3,388
44000000,"Action, Comedy",Released,The Film Hackers Tried To Get Banned,The Interview,6.1,2304
42000000,"Adventure, Fantasy, Action, Western, Thriller",Released,Assassin. Hero. Legend.,The Warrior's Way,6.3,136
33000000,"Action, Comedy, Crime",Released,Non Stop Madness,Micmacs,6.8,148
41000000,"Drama",Released,Every moment is another chance.,8 Mile,6.8,1626
0,"Adventure, Comedy, Animation",Released,These feet are made for walkin',Why I Did (Not) Eat My Father,5.3,125
65000000,"Adventure, Drama, Romance, Action",Released,He Will Rock You,A Knight's Tale,6.6,907
41000000,"Thriller, Fantasy, Action, Comedy",Released,null,The Medallion,5.3,281
40000000,"Mystery, Thriller, Drama",Released,Not every gift is a blessing.,The Sixth Sense,7.7,3147
42000000,"Action, Thriller, Crime",Released,You can only push an innocent man so far,Man on a Ledge,6.2,925
41000000,"Comedy",Released,Everyone is searching for something.,The Big Year,5.6,248
8000000,"Drama",Released,Only the 'Old One' could teach him the secrets of the masters.,The Karate Kid,6.9,891
40000000,"Drama, Crime",Released,Everyone Hustles To Survive,American Hustle,6.8,2807
40000000,"Comedy, Romance, Drama",Released,Here comes the bribe...,The Proposal,6.7,1804
70000000,"Crime, Drama, Mystery, Thriller",Released,Murder isn't always a crime.,Double Jeopardy,6.2,278
40000000,"Adventure, Comedy, Family, Science Fiction",Released,"Roads? Where we're going, we don't need roads!",Back to the Future Part II,7.4,3829
40000000,"Action, Science Fiction",Released,The average person uses 10% of their brain capacity. Imagine what she could do with 100%.,Lucy,6.3,5878
40000000,"Drama, Romance, Thriller",Released,Are you curious?,Fifty Shades of Grey,5.2,3254
38000000,"Action, Adventure, Comedy, Family, Science Fiction",Released,3rd Mission. 3rd Dimension.,Spy Kids 3-D: Game Over,4.7,511
40000000,"Crime, Drama, Thriller",Released,Experience a time you'll never forget.,A Time to Kill,7.0,509
40000000,"Comedy",Released,Growing pains? They've got twelve of them!,Cheaper by the Dozen,6.0,699
40000000,"Action, Drama, Thriller, War",Released,Based on True Acts of Courage,Lone Survivor,7.4,1526
40000000,"Comedy",Released,"To achieve the incredible, you have to attempt the impossible.",A League of Their Own,6.7,354
40000000,"Horror",Released,The next true story from the case files of Ed and Lorraine Warren,The Conjuring 2,7.0,1949
40000000,"Drama",Released,You don't get to 500 million friends without making a few enemies.,The Social Network,7.1,3391
40000000,"Comedy, Romance, Drama",Released,Are you the exception...or the rule?,He's Just Not That Into You,6.2,959
45000000,"Comedy",Released,Bury the grudge. Burn the village.  See the saw.,Scary Movie 4,5.3,750
40000000,"Horror, Mystery",Released,Someone has taken their love of trilogies one step too far.,Scream 3,5.7,736
40000000,"Adventure, Comedy, Family, Science Fiction",Released,They've saved the best trip for last... But this time they may have gone too far.,Back to the Future Part III,7.1,2900
40000000,"Comedy",Released,An education in incarceration.,Get Hard,5.9,944
40000000,"Romance, Horror",Released,Love never dies.,Dracula,7.1,1056
40000000,"Romance, Drama",Released,Based on Two True Stories,Julie & Julia,6.6,560
40000000,"Drama",Released,The True Story Of An American Legend,42,6.8,787
40000000,"Thriller, Crime, Drama",Released,How far would you go to become someone else?,The Talented Mr. Ripley,7.0,767
40000000,"Comedy",Released,The Second Parts Are More Fools,Dumb and Dumber To,5.4,1127
